{
  "$schema": "https://spamcrackers.com/intelligence/model.schema.json",
  "model": "Email Abuse Intelligence Reference Model",
  "namespace": "EAI",
  "version": "1.0.0",
  "license": "CC BY 4.0",
  "attribution": "SpamCrackers — https://spamcrackers.com/intelligence/",
  "url": "https://spamcrackers.com/intelligence/",
  "governance": "https://spamcrackers.com/intelligence/governance/",
  "generated": "2026-07-15",
  "counts": {
    "pillars": 6,
    "techniques": 163,
    "evidenceClasses": 5
  },
  "pillars": [
    {
      "code": "SPM",
      "name": "Spam Campaign Intelligence",
      "url": "https://spamcrackers.com/intelligence/",
      "techniques": 28
    },
    {
      "code": "PHI",
      "name": "Phishing Intelligence",
      "url": "https://spamcrackers.com/intelligence/phishing/",
      "techniques": 30
    },
    {
      "code": "BEC",
      "name": "Business Email Compromise",
      "url": "https://spamcrackers.com/intelligence/bec/",
      "techniques": 27
    },
    {
      "code": "MAL",
      "name": "Malware Delivery",
      "url": "https://spamcrackers.com/intelligence/mal/",
      "techniques": 29
    },
    {
      "code": "SCM",
      "name": "Scam & Fraud",
      "url": "https://spamcrackers.com/intelligence/scam/",
      "techniques": 25
    },
    {
      "code": "SPO",
      "name": "Spoofing & Impersonation",
      "url": "https://spamcrackers.com/intelligence/spoofing/",
      "techniques": 24
    }
  ],
  "evidenceModel": {
    "classes": [
      {
        "code": "EAI-EV-NET",
        "class": "Network"
      },
      {
        "code": "EAI-EV-AUTH",
        "class": "Authentication"
      },
      {
        "code": "EAI-EV-CONT",
        "class": "Content"
      },
      {
        "code": "EAI-EV-BEHAV",
        "class": "Behavioural"
      },
      {
        "code": "EAI-EV-INFRA",
        "class": "Infrastructure"
      }
    ],
    "confidence": [
      "Low",
      "Moderate",
      "High",
      "Confirmed"
    ]
  },
  "techniques": [
    {
      "id": "SPM-CL-01",
      "pillar": "SPM",
      "phase": "SPM-CL",
      "name": "Urgency & scarcity framing",
      "description": "Language engineered to pressure fast, unconsidered action.",
      "signals": "Deadline, suspension and reward markers; high imperative density.",
      "defense": "Linguistic lure classifiers; combine with sender reputation rather than keywords alone.",
      "url": "https://spamcrackers.com/intelligence/#SPM-CL-01"
    },
    {
      "id": "SPM-CL-02",
      "pillar": "SPM",
      "phase": "SPM-CL",
      "name": "Brand & authority impersonation",
      "description": "Trusted logos, layouts and tone used to borrow credibility.",
      "signals": "Brand assets paired with a mismatched or unauthenticated sender.",
      "defense": "Brand-asset matching, logo detection, sender-to-brand consistency checks.",
      "url": "https://spamcrackers.com/intelligence/#SPM-CL-02"
    },
    {
      "id": "SPM-CL-03",
      "pillar": "SPM",
      "phase": "SPM-CL",
      "name": "Obfuscation",
      "description": "Intent is hidden from filters using encoding, invisible characters or image-only bodies.",
      "signals": "High image-to-text ratio, unicode anomalies, zero-width characters.",
      "defense": "Unicode normalisation, optical character recognition, structural analysis.",
      "url": "https://spamcrackers.com/intelligence/#SPM-CL-03"
    },
    {
      "id": "SPM-CL-04",
      "pillar": "SPM",
      "phase": "SPM-CL",
      "name": "Content polymorphism",
      "description": "Each recipient receives a slightly different message to defeat exact signatures.",
      "signals": "High template entropy; weak exact-match clustering across a burst.",
      "defense": "Fuzzy hashing and near-duplicate clustering rather than exact signatures.",
      "url": "https://spamcrackers.com/intelligence/#SPM-CL-04"
    },
    {
      "id": "SPM-DE-01",
      "pillar": "SPM",
      "phase": "SPM-DE",
      "name": "Redirect & cloaking chains",
      "description": "Links pass through shorteners and multiple hops, sometimes serving different content to analysers than to victims.",
      "signals": "URL shorteners, multi-hop redirects, geo- or user-agent-based cloaking.",
      "defense": "URL detonation in a sandbox, follow chains, analyse final destinations.",
      "url": "https://spamcrackers.com/intelligence/#SPM-DE-01"
    },
    {
      "id": "SPM-DE-02",
      "pillar": "SPM",
      "phase": "SPM-DE",
      "name": "Reputation warming",
      "description": "A new IP or domain is ramped up gradually to build trust before abuse.",
      "signals": "Steady volume increase on young infrastructure; benign early sends.",
      "defense": "Model sender tenure and velocity together; treat trust as earned over time.",
      "url": "https://spamcrackers.com/intelligence/#SPM-DE-02"
    },
    {
      "id": "SPM-DE-03",
      "pillar": "SPM",
      "phase": "SPM-DE",
      "name": "Send-and-burn",
      "description": "Infrastructure is used intensively for a short window then abandoned.",
      "signals": "Sources active for hours then silent; rapid infrastructure turnover.",
      "defense": "Fast indicator sharing, first-contact caution, short-tenure penalties.",
      "url": "https://spamcrackers.com/intelligence/#SPM-DE-03"
    },
    {
      "id": "SPM-DE-04",
      "pillar": "SPM",
      "phase": "SPM-DE",
      "name": "List bombing & subscription abuse",
      "description": "Signup and confirmation flows are abused to flood a target with mail.",
      "signals": "Bursts of subscription-confirmation messages to one recipient.",
      "defense": "Rate limits and challenge mechanisms on signup forms; double-opt-in hygiene.",
      "url": "https://spamcrackers.com/intelligence/#SPM-DE-04"
    },
    {
      "id": "SPM-DE-05",
      "pillar": "SPM",
      "phase": "SPM-DE",
      "name": "Locale & timing targeting",
      "description": "Delivery is timed to a victim's business hours and locale to raise engagement.",
      "signals": "Send timing aligned to recipient time zone and working hours.",
      "defense": "Temporal baselining of normal correspondence patterns.",
      "url": "https://spamcrackers.com/intelligence/#SPM-DE-05"
    },
    {
      "id": "SPM-EP-01",
      "pillar": "SPM",
      "phase": "SPM-EP",
      "name": "Credential-harvest destinations",
      "description": "Cloned login pages hosted to capture entered credentials.",
      "signals": "Login clones on newly-registered domains or throwaway hosting; brand mismatch.",
      "defense": "Destination reputation, sandbox rendering, credential-form detection.",
      "url": "https://spamcrackers.com/intelligence/#SPM-EP-01"
    },
    {
      "id": "SPM-EP-02",
      "pillar": "SPM",
      "phase": "SPM-EP",
      "name": "Weaponised attachments",
      "description": "Documents or archives carrying macros, scripts or executables.",
      "signals": "Macro-enabled documents, risky archive and file types, double extensions.",
      "defense": "Attachment sandboxing, file-type policy, macro restrictions.",
      "url": "https://spamcrackers.com/intelligence/#SPM-EP-02"
    },
    {
      "id": "SPM-EP-03",
      "pillar": "SPM",
      "phase": "SPM-EP",
      "name": "Reply funnels",
      "description": "The message invites a reply that moves the victim into a fraud conversation.",
      "signals": "Free-mail reply-to, thread hijacking, reply-to and From divergence.",
      "defense": "Reply-to and From mismatch flags, conversation-thread integrity checks.",
      "url": "https://spamcrackers.com/intelligence/#SPM-EP-03"
    },
    {
      "id": "SPM-EP-04",
      "pillar": "SPM",
      "phase": "SPM-EP",
      "name": "Tracking beacons",
      "description": "Invisible images and unique links confirm live, engaged recipients.",
      "signals": "One-pixel images, per-recipient tracking URLs.",
      "defense": "Image proxying and stripping, link rewriting and neutralisation.",
      "url": "https://spamcrackers.com/intelligence/#SPM-EP-04"
    },
    {
      "id": "SPM-IA-01",
      "pillar": "SPM",
      "phase": "SPM-IA",
      "name": "Snowshoe distribution",
      "description": "Sending volume is spread thinly across a wide range of IP addresses and domains so no single source crosses a reputation or rate threshold.",
      "signals": "Many low-volume, newly-seen IPs across unrelated netblocks; shared content fingerprints across sources.",
      "defense": "Score reputation at the netblock and ASN level, not just per-IP; baseline expected volume per source.",
      "url": "https://spamcrackers.com/intelligence/#SPM-IA-01"
    },
    {
      "id": "SPM-IA-02",
      "pillar": "SPM",
      "phase": "SPM-IA",
      "name": "Botnet / compromised hosts",
      "description": "Mail originates from large numbers of compromised end-user machines.",
      "signals": "Residential or dynamic IP ranges, missing or generic reverse DNS, inconsistent HELO identities.",
      "defense": "Apply policy-block and dynamic-user lists; treat residential-origin mail with caution.",
      "url": "https://spamcrackers.com/intelligence/#SPM-IA-02"
    },
    {
      "id": "SPM-IA-03",
      "pillar": "SPM",
      "phase": "SPM-IA",
      "name": "Compromised account abuse",
      "description": "A legitimate mailbox or tenant is taken over and used to send.",
      "signals": "Sudden change in sending behaviour, geolocation or velocity anomalies, unusual send times.",
      "defense": "Authentication-anomaly detection, adaptive rate limits, session and device baselining.",
      "url": "https://spamcrackers.com/intelligence/#SPM-IA-03"
    },
    {
      "id": "SPM-IA-04",
      "pillar": "SPM",
      "phase": "SPM-IA",
      "name": "ESP / bulk-provider abuse",
      "description": "Legitimate email-service providers are used to distribute abusive lists.",
      "signals": "Valid provider headers paired with abusive content or unconsented recipients.",